{
  "generated_at": "2026-07-09",
  "criteria": {
    "publishable": "공식 상세 출처와 경사·단차·바닥 상태 검수 완료 후 active 전환 가능",
    "blocked": "공식 상세 출처 또는 현장/로드뷰 이미지 검수 필드가 부족하면 hidden 유지"
  },
  "summary": {
    "total": 17,
    "by_decision": {
      "blocked_pending_detail_review": 17
    },
    "by_image_review_status": {
      "ready_for_image_review": 17
    },
    "total_roadview_images": 1023,
    "blocker_counts": {
      "official_detail_source_required": 17,
      "slope_or_stairs_review_required": 17,
      "surface_condition_review_required": 17,
      "crowd_level_policy_required": 17
    }
  },
  "items": [
    {
      "card": {
        "id": "jeju_roadview_place_038",
        "name": "국립제주박물관",
        "region": "제주시",
        "category": "indoor",
        "verification_status": "partial"
      },
      "current_status": "hidden",
      "decision": "blocked_pending_detail_review",
      "blockers": [
        "official_detail_source_required",
        "slope_or_stairs_review_required",
        "surface_condition_review_required",
        "crowd_level_policy_required"
      ],
      "required_checks": [
        "crowd_level_policy_review",
        "official_detail_source_review",
        "operating_status_review",
        "slope_or_stairs_review",
        "surface_condition_review"
      ],
      "roadview_image_evidence": {
        "image_count": 132,
        "captured_date_start": "2022-08-23",
        "captured_date_end": "2022-08-23",
        "sample_image_file_names": [
          "JEJUNATIONALMU-1-001",
          "JEJUNATIONALMU-1-002",
          "JEJUNATIONALMU-1-003"
        ],
        "review_status": "ready_for_image_review"
      },
      "official_source_queries": [
        "이지제주 국립제주박물관",
        "열린관광 모두의 여행 국립제주박물관",
        "국립제주박물관 공식 홈페이지 장애인 화장실 주차 휠체어"
      ],
      "recommended_action": "hidden 유지. 공식 상세 출처와 로드뷰 이미지로 차단 사유를 해소한 뒤 active 전환 검토"
    },
    {
      "card": {
        "id": "jeju_roadview_place_088",
        "name": "김녕미로공원",
        "region": "제주시",
        "category": "rest_area",
        "verification_status": "partial"
      },
      "current_status": "hidden",
      "decision": "blocked_pending_detail_review",
      "blockers": [
        "official_detail_source_required",
        "slope_or_stairs_review_required",
        "surface_condition_review_required",
        "crowd_level_policy_required"
      ],
      "required_checks": [
        "crowd_level_policy_review",
        "official_detail_source_review",
        "operating_status_review",
        "slope_or_stairs_review",
        "surface_condition_review"
      ],
      "roadview_image_evidence": {
        "image_count": 15,
        "captured_date_start": "2022-09-26",
        "captured_date_end": "2022-09-26",
        "sample_image_file_names": [
          "GIMNYEONGMAZEPA-1-001",
          "GIMNYEONGMAZEPA-1-002",
          "GIMNYEONGMAZEPA-1-003"
        ],
        "review_status": "ready_for_image_review"
      },
      "official_source_queries": [
        "이지제주 김녕미로공원",
        "열린관광 모두의 여행 김녕미로공원",
        "김녕미로공원 공식 홈페이지 장애인 화장실 주차 휠체어"
      ],
      "recommended_action": "hidden 유지. 공식 상세 출처와 로드뷰 이미지로 차단 사유를 해소한 뒤 active 전환 검토"
    },
    {
      "card": {
        "id": "jeju_roadview_place_100",
        "name": "삼성혈",
        "region": "제주시",
        "category": "culture",
        "verification_status": "partial"
      },
      "current_status": "hidden",
      "decision": "blocked_pending_detail_review",
      "blockers": [
        "official_detail_source_required",
        "slope_or_stairs_review_required",
        "surface_condition_review_required",
        "crowd_level_policy_required"
      ],
      "required_checks": [
        "crowd_level_policy_review",
        "official_detail_source_review",
        "operating_status_review",
        "slope_or_stairs_review",
        "surface_condition_review"
      ],
      "roadview_image_evidence": {
        "image_count": 52,
        "captured_date_start": "2022-09-29",
        "captured_date_end": "2022-09-29",
        "sample_image_file_names": [
          "SAMSUNGHYEOL-1-001",
          "SAMSUNGHYEOL-1-002",
          "SAMSUNGHYEOL-1-003"
        ],
        "review_status": "ready_for_image_review"
      },
      "official_source_queries": [
        "이지제주 삼성혈",
        "열린관광 모두의 여행 삼성혈",
        "삼성혈 공식 홈페이지 장애인 화장실 주차 휠체어"
      ],
      "recommended_action": "hidden 유지. 공식 상세 출처와 로드뷰 이미지로 차단 사유를 해소한 뒤 active 전환 검토"
    },
    {
      "card": {
        "id": "jeju_roadview_place_095",
        "name": "상효원수목원",
        "region": "서귀포시",
        "category": "forest",
        "verification_status": "partial"
      },
      "current_status": "hidden",
      "decision": "blocked_pending_detail_review",
      "blockers": [
        "official_detail_source_required",
        "slope_or_stairs_review_required",
        "surface_condition_review_required",
        "crowd_level_policy_required"
      ],
      "required_checks": [
        "crowd_level_policy_review",
        "official_detail_source_review",
        "operating_status_review",
        "slope_or_stairs_review",
        "surface_condition_review"
      ],
      "roadview_image_evidence": {
        "image_count": 73,
        "captured_date_start": "2022-09-28",
        "captured_date_end": "2022-09-28",
        "sample_image_file_names": [
          "SANGHYO-1-001",
          "SANGHYO-1-002",
          "SANGHYO-1-003"
        ],
        "review_status": "ready_for_image_review"
      },
      "official_source_queries": [
        "이지제주 상효원수목원",
        "열린관광 모두의 여행 상효원수목원",
        "상효원수목원 공식 홈페이지 장애인 화장실 주차 휠체어"
      ],
      "recommended_action": "hidden 유지. 공식 상세 출처와 로드뷰 이미지로 차단 사유를 해소한 뒤 active 전환 검토"
    },
    {
      "card": {
        "id": "jeju_roadview_place_053",
        "name": "서귀포시립기당미술관",
        "region": "서귀포시",
        "category": "indoor",
        "verification_status": "partial"
      },
      "current_status": "hidden",
      "decision": "blocked_pending_detail_review",
      "blockers": [
        "official_detail_source_required",
        "slope_or_stairs_review_required",
        "surface_condition_review_required",
        "crowd_level_policy_required"
      ],
      "required_checks": [
        "crowd_level_policy_review",
        "official_detail_source_review",
        "operating_status_review",
        "slope_or_stairs_review",
        "surface_condition_review"
      ],
      "roadview_image_evidence": {
        "image_count": 14,
        "captured_date_start": "2022-08-31",
        "captured_date_end": "2022-08-31",
        "sample_image_file_names": [
          "GIDANG-1-001",
          "GIDANG-1-002",
          "GIDANG-1-003"
        ],
        "review_status": "ready_for_image_review"
      },
      "official_source_queries": [
        "이지제주 서귀포시립기당미술관",
        "열린관광 모두의 여행 서귀포시립기당미술관",
        "서귀포시립기당미술관 공식 홈페이지 장애인 화장실 주차 휠체어"
      ],
      "recommended_action": "hidden 유지. 공식 상세 출처와 로드뷰 이미지로 차단 사유를 해소한 뒤 active 전환 검토"
    },
    {
      "card": {
        "id": "jeju_roadview_place_104",
        "name": "스누피가든",
        "region": "제주시",
        "category": "other",
        "verification_status": "partial"
      },
      "current_status": "hidden",
      "decision": "blocked_pending_detail_review",
      "blockers": [
        "official_detail_source_required",
        "slope_or_stairs_review_required",
        "surface_condition_review_required",
        "crowd_level_policy_required"
      ],
      "required_checks": [
        "category_refinement",
        "crowd_level_policy_review",
        "official_detail_source_review",
        "operating_status_review",
        "slope_or_stairs_review",
        "surface_condition_review"
      ],
      "roadview_image_evidence": {
        "image_count": 168,
        "captured_date_start": "2022-09-30",
        "captured_date_end": "2022-09-30",
        "sample_image_file_names": [
          "SNOOPYGARDEN-1-001",
          "SNOOPYGARDEN-1-002",
          "SNOOPYGARDEN-1-003"
        ],
        "review_status": "ready_for_image_review"
      },
      "official_source_queries": [
        "이지제주 스누피가든",
        "열린관광 모두의 여행 스누피가든",
        "스누피가든 공식 홈페이지 장애인 화장실 주차 휠체어"
      ],
      "recommended_action": "hidden 유지. 공식 상세 출처와 로드뷰 이미지로 차단 사유를 해소한 뒤 active 전환 검토"
    },
    {
      "card": {
        "id": "jeju_roadview_4_3_001",
        "name": "제주4.3평화공원",
        "region": "제주시",
        "category": "rest_area",
        "verification_status": "partial"
      },
      "current_status": "hidden",
      "decision": "blocked_pending_detail_review",
      "blockers": [
        "official_detail_source_required",
        "slope_or_stairs_review_required",
        "surface_condition_review_required",
        "crowd_level_policy_required"
      ],
      "required_checks": [
        "crowd_level_policy_review",
        "official_detail_source_review",
        "operating_status_review",
        "slope_or_stairs_review",
        "surface_condition_review"
      ],
      "roadview_image_evidence": {
        "image_count": 127,
        "captured_date_start": "2022-07-15",
        "captured_date_end": "2022-11-19",
        "sample_image_file_names": [
          "JEJU43PA-1-001",
          "JEJU43PA-1-002",
          "JEJU43PA-1-003"
        ],
        "review_status": "ready_for_image_review"
      },
      "official_source_queries": [
        "이지제주 제주4.3평화공원",
        "열린관광 모두의 여행 제주4.3평화공원",
        "제주4.3평화공원 공식 홈페이지 장애인 화장실 주차 휠체어"
      ],
      "recommended_action": "hidden 유지. 공식 상세 출처와 로드뷰 이미지로 차단 사유를 해소한 뒤 active 전환 검토"
    },
    {
      "card": {
        "id": "jeju_roadview_place_066",
        "name": "제주고산리유적",
        "region": "제주시",
        "category": "culture",
        "verification_status": "partial"
      },
      "current_status": "hidden",
      "decision": "blocked_pending_detail_review",
      "blockers": [
        "official_detail_source_required",
        "slope_or_stairs_review_required",